[
  {
    "id": "kelvin-1896-aerial-navigation",
    "claim": "I have not the smallest molecule of faith in aerial navigation other than ballooning or of expectation of good results from any of the trials we hear of.",
    "context": "Letter declining to join the Aeronautical Society, addressed to Major Baden Baden-Powell.",
    "predictor": {
      "name": "William Thomson, Lord Kelvin",
      "role_at_time": "Physicist; President of the Royal Society 1890-95",
      "expertise_domain": "Physics",
      "speaking_in_own_field": false,
      "standing": "researcher"
    },
    "made": "1896-12-08",
    "venue": "Private letter, later published",
    "source": {
      "url": "https://zapatopi.net/kelvin/papers/letters.html/interview_aeronautics_and_wireless.html",
      "type": "primary",
      "note": "Image of handwritten original; also reproduced in J. Laurence Pritchard, Journal of the Royal Aeronautical Society 60 (1956), pp. 13-14."
    },
    "deadline": {
      "stated": false
    },
    "domain": "technology",
    "tags": [
      "aviation",
      "impossibility"
    ],
    "verdict": "wrong",
    "resolution": {
      "summary": "The Wright brothers made the first controlled, powered heavier-than-air flight on 17 December 1903.",
      "resolved_date": "1903-12-17",
      "source_url": "https://airandspace.si.edu/explore/stories/1903-wright-flyer"
    },
    "confidence_expressed": "not the smallest molecule of faith",
    "status": "verified",
    "notes": "The widely circulated 'Heavier-than-air flying machines are impossible (1895)' has no primary source and is listed under rejected entries. This letter is the documented version.",
    "added": "2026-09-15",
    "last_reviewed": "2026-09-15"
  },
  {
    "id": "fisher-1929-permanently-high-plateau",
    "claim": "Stock prices have reached what looks like a permanently high plateau.",
    "context": "Remarks at the monthly dinner of the Purchasing Agents Association, New York, reported the next day by the New York Times.",
    "predictor": {
      "name": "Irving Fisher",
      "role_at_time": "Professor of Economics, Yale University",
      "expertise_domain": "Economics",
      "speaking_in_own_field": true,
      "standing": "researcher"
    },
    "made": "1929-10-15",
    "venue": "Purchasing Agents Association dinner, New York",
    "source": {
      "url": "https://www.nytimes.com/1929/10/16/archives/fisher-sees-stocks-permanently-high-yale-economist-tells-purchasing.html",
      "type": "contemporaneous-report",
      "note": "New York Times, 16 Oct 1929, p.8, 'Fisher Sees Stocks Permanently High'. ProQuest docview 104696595. Reproduced in Duckenfield (ed.), Routledge, 2024."
    },
    "deadline": {
      "stated": true,
      "text": "within a few months",
      "date": "1930"
    },
    "domain": "economics",
    "tags": [
      "stock-market",
      "1929-crash"
    ],
    "verdict": "wrong",
    "resolution": {
      "summary": "The market crashed on 28-29 October 1929. The Dow fell roughly 89% from its 1929 peak to its 1932 low.",
      "resolved_date": "1929-10-29",
      "source_url": "https://www.federalreservehistory.org/essays/stock-market-crash-of-1929"
    },
    "confidence_expressed": "what looks like a permanently high plateau",
    "status": "verified",
    "added": "2026-09-15",
    "last_reviewed": "2026-09-15"
  },
  {
    "id": "keynes-1930-grandchildren",
    "claim": "I would predict that the standard of life in progressive countries one hundred years hence will be between four and eight times as high as it is to-day. [...] Three-hour shifts or a fifteen-hour week may put off the problem for a great while.",
    "context": "Essay 'Economic Possibilities for our Grandchildren', first published in The Nation and Athenaeum, later in Essays in Persuasion.",
    "predictor": {
      "name": "John Maynard Keynes",
      "role_at_time": "Economist, Cambridge",
      "expertise_domain": "Economics",
      "speaking_in_own_field": true,
      "standing": "researcher"
    },
    "made": "1930",
    "venue": "The Nation and Athenaeum",
    "source": {
      "url": "https://www.marxists.org/reference/subject/economics/keynes/1930/our-grandchildren.htm",
      "type": "primary"
    },
    "deadline": {
      "stated": true,
      "text": "one hundred years hence",
      "date": "2030"
    },
    "domain": "economics",
    "tags": [
      "living-standards",
      "working-hours"
    ],
    "verdict": "partially-right",
    "resolution": {
      "summary": "Real income per person in advanced economies rose within or beyond the four-to-eight-fold range. Average working hours fell but remain roughly 35-40 per week, not 15.",
      "resolved_date": "2026",
      "source_url": "https://ourworldindata.org/working-hours"
    },
    "confidence_expressed": "I would predict",
    "status": "verified",
    "notes": "Two claims in one essay. The growth claim resolved right; the hours claim resolved wrong. Not yet at the stated 2030 deadline but the gap is not closable.",
    "added": "2026-09-15",
    "last_reviewed": "2026-09-15"
  },
  {
    "id": "rutherford-1933-moonshine",
    "claim": "Any one who says that with the means at present at our disposal and with our present knowledge we can utilize atomic energy is talking moonshine.",
    "context": "Address to the British Association for the Advancement of Science, Leicester. Wording varies between newspapers; this is the New York Times version.",
    "predictor": {
      "name": "Ernest Rutherford",
      "role_at_time": "Director, Cavendish Laboratory; Nobel laureate",
      "expertise_domain": "Nuclear physics",
      "speaking_in_own_field": true,
      "standing": "researcher"
    },
    "made": "1933-09-11",
    "venue": "British Association meeting, Leicester",
    "source": {
      "url": "https://quoteinvestigator.com/2018/11/26/moonshine/",
      "type": "contemporaneous-report",
      "note": "Quote Investigator collates NYT 12 Sept 1933, AP 11 Sept 1933 and The Times. Exact wording is uncertain; the claim is consistent across reports."
    },
    "deadline": {
      "stated": false
    },
    "domain": "science",
    "tags": [
      "nuclear",
      "impossibility"
    ],
    "verdict": "wrong",
    "resolution": {
      "summary": "Nuclear fission was discovered in December 1938. The first self-sustaining chain reaction ran on 2 December 1942.",
      "resolved_date": "1942-12-02",
      "source_url": "https://www.atomicarchive.com/history/manhattan-project/p1s2.html"
    },
    "confidence_expressed": "talking moonshine",
    "status": "verified",
    "notes": "Rutherford qualified the claim with 'with our present knowledge'. Whether that makes it a hedge or a prediction is a judgement call; recorded as made.",
    "added": "2026-09-15",
    "last_reviewed": "2026-09-15"
  },
  {
    "id": "einstein-1934-nuclear-energy",
    "claim": "There is not the slightest indication that [nuclear energy] will ever be obtainable. It would mean that the atom would have to be shattered at will.",
    "context": "Reported remarks to the press in Pittsburgh.",
    "predictor": {
      "name": "Albert Einstein",
      "role_at_time": "Physicist, Institute for Advanced Study",
      "expertise_domain": "Physics",
      "speaking_in_own_field": true,
      "standing": "researcher"
    },
    "made": "1934-12-29",
    "venue": "Pittsburgh Post-Gazette",
    "source": {
      "url": "https://en.wikiquote.org/wiki/Albert_Einstein",
      "type": "contemporaneous-report",
      "note": "Wikiquote sourced section cites 'Atom Energy Hope is Spiked By Einstein / Efforts at Loosing Vast Force is Called Fruitless', Pittsburgh Post-Gazette, 29 Dec 1934. The square brackets are the citing source's; the newspaper page itself has not been inspected."
    },
    "deadline": {
      "stated": false
    },
    "domain": "science",
    "tags": [
      "nuclear",
      "impossibility"
    ],
    "verdict": "wrong",
    "resolution": {
      "summary": "Controlled nuclear chain reaction achieved 2 December 1942; first nuclear power to a grid in 1954.",
      "resolved_date": "1942-12-02"
    },
    "confidence_expressed": "not the slightest indication",
    "status": "verified",
    "notes": "Upgrade the source to the newspaper scan if one is located.",
    "added": "2026-09-15",
    "last_reviewed": "2026-09-15"
  },
  {
    "id": "clarke-1945-extra-terrestrial-relays",
    "claim": "A true broadcast service, giving constant field strength at all times over the whole globe would be invaluable, not to say indispensable, in a world society. [...] 30 E — Africa and Europe. 150 E — China and Oceana. 90 W — The Americas.",
    "context": "Article 'Extra-Terrestrial Relays: Can Rocket Stations Give World-wide Radio Coverage?' proposing satellites in 24-hour orbit.",
    "predictor": {
      "name": "Arthur C. Clarke",
      "role_at_time": "RAF radar officer; science fiction writer",
      "expertise_domain": "Radio engineering, fiction",
      "speaking_in_own_field": true,
      "standing": "commentator"
    },
    "made": "1945-10",
    "venue": "Wireless World",
    "source": {
      "url": "https://lakdiva.org.lk/clarke/1945ww/1945ww_oct_305-308.html",
      "type": "primary",
      "note": "Copy-edited OCR of the October 1945 article with page scans."
    },
    "deadline": {
      "stated": false
    },
    "domain": "technology",
    "tags": [
      "satellites",
      "communications"
    ],
    "verdict": "right",
    "resolution": {
      "summary": "Syncom 3 became the first geostationary communications satellite in 1964. Hundreds now occupy the orbit, informally named the Clarke Belt.",
      "resolved_date": "1964-08-19",
      "source_url": "https://ethw.org/Clarke_Suggests_Geosynchronous_Orbit"
    },
    "confidence_expressed": "could give",
    "status": "verified",
    "notes": "Clarke assumed crewed stations launched by V-2 derivatives. The three-station geostationary layout is what is scored.",